{"$schema":"https://json-schema.org/draft/2020-12/schema","$id":"https://eliasworks.dev/blueprint/0.5.0/api-impact.schema.json","title":"Blueprint API Change Impact","type":"object","required":["schema_version","change_id","previous_revision","new_revision","classification","changed_operation_ids","changed_contract_areas","affected_slices","revalidation_policy","evidence_ids"],"properties":{"schema_version":{"const":"0.5.0"},"change_id":{"type":"string","pattern":"^API-IMPACT-[0-9]{3,}$"},"previous_revision":{"type":"string","minLength":1},"new_revision":{"type":"string","minLength":1},"classification":{"enum":["operation_local","platform_cross_cutting","project_cross_cutting"]},"changed_operation_ids":{"type":"array","uniqueItems":true,"items":{"type":"string","minLength":1}},"changed_contract_areas":{"type":"array","uniqueItems":true,"items":{"enum":["auth","authorization","security","error_contract","versioning","data_schema","other"]}},"affected_slices":{"type":"array","uniqueItems":true,"items":{"type":"object","required":["id","platform"],"properties":{"id":{"type":"string","pattern":"^[a-z0-9][a-z0-9._-]*$"},"platform":{"enum":["web","android"]}},"additionalProperties":false}},"revalidation_policy":{"enum":["affected_only","platform","project"]},"preserve_unrelated_evidence":{"const":true},"evidence_ids":{"type":"array","minItems":1,"uniqueItems":true,"items":{"type":"string","pattern":"^EVD-[A-Z0-9][A-Z0-9._-]*$"}},"note":{"type":"string"}},"allOf":[{"if":{"properties":{"classification":{"const":"operation_local"}},"required":["classification"]},"then":{"properties":{"revalidation_policy":{"const":"affected_only"}}}},{"if":{"properties":{"classification":{"const":"platform_cross_cutting"}},"required":["classification"]},"then":{"properties":{"revalidation_policy":{"const":"platform"}}}},{"if":{"properties":{"classification":{"const":"project_cross_cutting"}},"required":["classification"]},"then":{"properties":{"revalidation_policy":{"const":"project"}}}}],"additionalProperties":false}
