{
  "schema_version": "0.5.0",
  "change_id": "API-IMPACT-002",
  "previous_revision": "api-v1-r2",
  "new_revision": "api-v1-r3",
  "classification": "platform_cross_cutting",
  "changed_operation_ids": [
    "authenticateOperator",
    "listClaims",
    "getClaimDetail",
    "listTasks",
    "listClaimTasks",
    "completeClaimTask",
    "getClaimTimeline",
    "moveClaimOperationalStage",
    "createClaimTask",
    "getClaimTask",
    "updateClaimTask",
    "cancelClaimTask",
    "getClaimsOperationalMetrics",
    "listPipelines",
    "getPipeline",
    "createPipeline",
    "createPipelineVersion",
    "activatePipelineVersion",
    "updatePipelineState",
    "listCommunicationTemplates",
    "getCommunicationTemplate",
    "createCommunicationTemplate",
    "createCommunicationTemplateVersion",
    "activateCommunicationTemplateVersion",
    "updateCommunicationTemplateState",
    "requestCommunication",
    "listCommunications",
    "getCommunication",
    "ingestIntegrationEvent",
    "getIntegrationEventStatus",
    "listAutomations",
    "getAutomation",
    "createAutomation",
    "createAutomationVersion",
    "activateAutomationVersion",
    "updateAutomationState",
    "listCustomers",
    "getCustomer",
    "listPolicies",
    "getPolicy",
    "listGuidances",
    "getGuidance",
    "createGuidance",
    "createGuidanceVersion",
    "activateGuidanceVersion",
    "updateGuidanceState",
    "authenticateCustomer",
    "getPortalSelf",
    "listPortalPolicies",
    "listPortalClaims",
    "getPortalClaimDetail",
    "uploadPortalClaimEvidence",
    "listPortalCommunications",
    "listImportJobs",
    "createImportJob",
    "getImportJob",
    "previewImportJob",
    "updateImportMapping",
    "validateImportJob",
    "dryRunImportJob",
    "commitImportJob",
    "listImportJobRows",
    "listRenewalCases",
    "getRenewalCase",
    "transitionRenewalCase",
    "moveRenewalOperationalStage",
    "listCollectionCases",
    "getCollectionCase",
    "transitionCollectionCase",
    "moveCollectionOperationalStage",
    "updateCollectionPaymentState",
    "listCustomFields",
    "getCustomField",
    "createCustomField",
    "createCustomFieldVersion",
    "activateCustomFieldVersion",
    "updateCustomFieldState",
    "executeBulkOperation",
    "listDeadLetters",
    "getDeadLetter",
    "requeueDeadLetter",
    "resolveDeadLetter"
  ],
  "changed_contract_areas": [
    "auth",
    "authorization",
    "security",
    "error_contract",
    "versioning",
    "data_schema",
    "other"
  ],
  "affected_slices": [
    {"id": "claims-backoffice", "platform": "web"}
  ],
  "revalidation_policy": "platform",
  "preserve_unrelated_evidence": true,
  "evidence_ids": [
    "EVD-API-R3-CONTRACT-001",
    "EVD-API-R3-IMPACT-001"
  ],
  "note": "R3 adds the governed Insurance Operations REST surface and cross-cutting staff/customer/integration security contexts while preserving all 15 historical operationIds and routes. Seven existing operations receive additive or permission refinements. Platform web revalidation is required; unrelated accepted v0.1.0/v0.2.0 evidence remains immutable. Evidence IDs identify this R3 contract/impact review package and do not claim implementation or API Gate acceptance."
}
